<!ELEMENT branches (branch*)>
<!ELEMENT branch (address, contact, hours, mapsLink)>
<!ELEMENT address (#PCDATA)>
<!ELEMENT contact (#PCDATA)>
<!ELEMENT hours (#PCDATA)>
<!ELEMENT mapsLink (#PCDATA)>